O'CONNOR,O'Connor Cooperative School,Black Mountain School,St Joseph's Primary School,,,,,,,,,,,,,,,,,,,,,
WANNIASSA,Erindale College,St Mary MacKillop College - Wanniassa Campus,Wanniassa Hills Primary School,Wanniassa School,Wanniassa School - Junior Campus,St Anthony's Parish Primary School,Trinity Christian School,,,,,,,,,,,,,,,,,
HAWKER,Hawker College,Belconnen High School,Hawker Primary School,,,,,,,,,,,,,,,,,,,,,
NARRABUNDAH,Narrabundah College,Narrabundah Early Childhood School,St Benedict's Primary School,,,,,,,,,,,,,,,,,,,,,
SCULLIN,Southern Cross Early Childhood School,,,,,,,,,,,,,,,,,,,,,,,
LYONS,Lyons Early Childhood School,,,,,,,,,,,,,,,,,,,,,,,
CHISHOLM,Caroline Chisholm School,Caroline Chisholm School - Junior Campus,St Aloysius Catholic Primary School,,,,,,,,,,,,,,,,,,,,,
ISABELLA PLAINS,Isabella Plains Early Childhood School,St Mary MacKillop College,,,,,,,,,,,,,,,,,,,,,,
PHILLIP,The Canberra College,,,,,,,,,,,,,,,,,,,,,,,
DICKSON,Daramalan College,Dickson College,Emmaus Christian School,,,,,,,,,,,,,,,,,,,,,
PEARCE,Marist College Canberra,Melrose High School,Sacred Heart Primary School,,,,,,,,,,,,,,,,,,,,,
GRIFFITH,St Edmund's College Canberra,St Clare's College,Griffith Public School,Griffith North Public School,Griffith East Public School,Kalinda School,Griffith High School,Wade High School,St Patrick's Primary School,Marian Catholic College,,,,,,,,,,,,,,
CAMPBELL,Canberra Grammar School - Northside Infants Campus,Campbell High School,Campbell Primary School,St Thomas More's Primary School,,,,,,,,,,,,,,,,,,,,
RED HILL,Canberra Montessori School - Red Hill Campus,Red Hill Primary School,St Bede's Primary School,Canberra Grammar School - Primary School,Canberra Grammar School,,,,,,,,,,,,,,,,,,,
FORDE,Burgmann Anglican School - Forde Campus,,,,,,,,,,,,,,,,,,,,,,,
HARRISON,Mother Teresa School,Harrison School,,,,,,,,,,,,,,,,,,,,,,
AMAROO,Amaroo School,Good Shepherd Primary School,,,,,,,,,,,,,,,,,,,,,,
ARANDA,Aranda Primary School,St Vincent's Primary School,,,,,,,,,,,,,,,,,,,,,,
MACQUARIE,Canberra High School,Macquarie Primary School,,,,,,,,,,,,,,,,,,,,,,
CHARNWOOD,Charnwood-Dunlop School,St Thomas Aquinas Primary School,Brindabella Christian College - Charnwood campus,,,,,,,,,,,,,,,,,,,,,
EVATT,Evatt Primary School,Miles Franklin Primary School,St Monica's Primary School,,,,,,,,,,,,,,,,,,,,,
FLOREY,Florey Primary School,St Francis Xavier College,St John the Apostle Primary School,,,,,,,,,,,,,,,,,,,,,
FRASER,Fraser Primary School,,,,,,,,,,,,,,,,,,,,,,,
GIRALANG,Giralang Primary School,,,,,,,,,,,,,,,,,,,,,,,
NICHOLLS,Gold Creek School,Holy Spirit Primary School,St John Paul II College,,,,,,,,,,,,,,,,,,,,,
JERVIS BAY,Jervis Bay School,,,,,,,,,,,,,,,,,,,,,,,
KALEEN,University of Canberra High School Kaleen,Kaleen Primary School,Maribyrnong Primary School,St Michael's Primary School,,,,,,,,,,,,,,,,,,,,
BELCONNEN,University of Canberra Senior Secondary College Lake Ginninderra,,,,,,,,,,,,,,,,,,,,,,,
LATHAM,Latham Primary School,,,,,,,,,,,,,,,,,,,,,,,
MACGREGOR,Macgregor Primary School,,,,,,,,,,,,,,,,,,,,,,,
MELBA,Melba Copland Secondary School Copland Campus Years 11 - 12,Mount Rogers Primary School,Melba Copland Secondary School,,,,,,,,,,,,,,,,,,,,,
NGUNNAWAL,Ngunnawal Primary School,,,,,,,,,,,,,,,,,,,,,,,
PALMERSTON,Palmerston District Primary School,,,,,,,,,,,,,,,,,,,,,,,
WEETANGERA,Weetangera Primary School,,,,,,,,,,,,,,,,,,,,,,,
HOLT,Cranleigh School,Kingsford Smith School,,,,,,,,,,,,,,,,,,,,,,
BRADDON,Ainslie School,Merici College,,,,,,,,,,,,,,,,,,,,,,
DEAKIN,Alfred Deakin High School,The Woden School,Canberra Girls Grammar School - Junior School,Canberra Girls Grammar School,,,,,,,,,,,,,,,,,,,,
CURTIN,Curtin Primary School,Holy Trinity Primary School,,,,,,,,,,,,,,,,,,,,,,
FARRER,Farrer Primary School,,,,,,,,,,,,,,,,,,,,,,,
FORREST,Forrest Primary School,,,,,,,,,,,,,,,,,,,,,,,
GARRAN,Garran Primary School,Malkara School,Sts Peter and Paul Primary School,,,,,,,,,,,,,,,,,,,,,
HUGHES,Hughes Primary School,,,,,,,,,,,,,,,,,,,,,,,
LYNEHAM,Lyneham High School,Lyneham Primary School,Brindabella Christian College,,,,,,,,,,,,,,,,,,,,,
WATSON,Majura Primary School,Rosary Primary School,,,,,,,,,,,,,,,,,,,,,,
MAWSON,Mawson Primary School,Canberra Christian School,,,,,,,,,,,,,,,,,,,,,,
AINSLIE,North Ainslie Primary School,,,,,,,,,,,,,,,,,,,,,,,
BARTON,Telopea Park School,,,,,,,,,,,,,,,,,,,,,,,
TORRENS,Torrens Primary School,,,,,,,,,,,,,,,,,,,,,,,
TURNER,Turner School,,,,,,,,,,,,,,,,,,,,,,,
YARRALUMLA,Yarralumla Primary School,,,,,,,,,,,,,,,,,,,,,,,
WARAMANGA,Arawang Primary School,Mount Stromlo High School,St John Vianney's Primary School,,,,,,,,,,,,,,,,,,,,,
BONYTHON,Bonython Primary School,,,,,,,,,,,,,,,,,,,,,,,
CALWELL,Calwell High School,Calwell Primary School,St Francis of Assisi Primary School,,,,,,,,,,,,,,,,,,,,,
CHAPMAN,Chapman Primary School,,,,,,,,,,,,,,,,,,,,,,,
CONDER,Charles Conder Primary School,Lanyon High School,St Clare of Assisi Primary School,,,,,,,,,,,,,,,,,,,,,
DUFFY,Duffy Primary School,,,,,,,,,,,,,,,,,,,,,,,
FADDEN,Fadden Primary School,,,,,,,,,,,,,,,,,,,,,,,
GILMORE,Gilmore Primary School,,,,,,,,,,,,,,,,,,,,,,,
GORDON,Gordon Primary School,Covenant Christian School,Gordon East Public School,Ravenswood School for Girls,"Ravenswood School for Girls, Boarding House",,,,,,,,,,,,,,,,,,,
GOWRIE,Gowrie Primary School,Holy Family Primary School,,,,,,,,,,,,,,,,,,,,,,
GREENWAY,Lake Tuggeranong College,,,,,,,,,,,,,,,,,,,,,,,
MONASH,Monash Primary School,,,,,,,,,,,,,,,,,,,,,,,
RICHARDSON,Richardson Primary School,,,,,,,,,,,,,,,,,,,,,,,
KAMBAH,Taylor Primary School,St Thomas the Apostle Primary School,Communities@Work Galilee School,Namadgi School,,,,,,,,,,,,,,,,,,,,
THEODORE,Theodore Primary School,,,,,,,,,,,,,,,,,,,,,,,
HOLDER,St Jude's Primary School,Canberra Montessori School,,,,,,,,,,,,,,,,,,,,,,
PAGE,St Matthew's Primary School,,,,,,,,,,,,,,,,,,,,,,,
HACKETT,Blue Gum Community School,,,,,,,,,,,,,,,,,,,,,,,
GUNGAHLIN,Burgmann Anglican School,Gungahlin College,,,,,,,,,,,,,,,,,,,,,,
WESTON,Islamic School of Canberra,Orana Steiner School,Weston Public School,,,,,,,,,,,,,,,,,,,,,
BRUCE,Radford College,,,,,,,,,,,,,,,,,,,,,,,
BONNER,Neville Bonner Primary School,,,,,,,,,,,,,,,,,,,,,,,
FRANKLIN,Franklin Early Childhood School,,,,,,,,,,,,,,,,,,,,,,,
SPENCE,Taqwa School,,,,,,,,,,,,,,,,,,,,,,,
COOMBS,Charles Weston School,,,,,,,,,,,,,,,,,,,,,,,
JINDERA,Saint Mary MacKillop College Albury,Jindera Public School,St John's Lutheran Primary School,,,,,,,,,,,,,,,,,,,,,
ROCKDALE,St Dominic Savio School,Kyeemagh Infants School,"St Mary and St Mina's Coptic Orthodox College, Rockdale campus",Rockdale Public School,St Joseph's Catholic Primary School,,,,,,,,,,,,,,,,,,,
WAGGA WAGGA,Saint Mary MacKillop Colleges Limited,Shepherds Park School,Riverina Environmental Education Centre,Wagga Wagga Public School,North Wagga Public School,South Wagga Public School,Turvey Park Public School,Kooringal Public School,Ashmont Public School,Red Hill Public School,Sturt Public School,Willans Hill School,The Bidgee School,Wagga Wagga High School,Mount Austin High School,Mater Dei Primary School,Sacred Heart Primary School,Henschke Primary School,St Joseph's Primary School,Kildare Catholic College,Mater Dei Catholic College,Wagga Wagga Christian College,The Riverina Anglican College,Lutheran School Wagga Wagga
RIVERSTONE,Australian Christian College - Distance Education,Riverstone Public School,Casuarina School,Riverstone High School,St John's Primary School,Norwest Christian College,Australian Christian College: Marsden Park,,,,,,,,,,,,,,,,,
TERREY HILLS,Kinma School,Terrey Hills Public School,German International School Sydney,Sydney Japanese International School,Northern Beaches Christian School,Mosman Preparatory School Outdoor Education Centre,,,,,,,,,,,,,,,,,,
WAHROONGA,Knox Grammar School,Waitara Public School,Wahroonga Public School,Prouille Catholic Primary School,St Leo's Catholic College,St Edmund’s College,St Lucy's School,Abbotsleigh,Knox Grammar Preparatory School,"Tangara School for Girls, Retaval Infants School campus, Wahroonga",Wahroonga Adventist School,Abbotsleigh Junior School,Wahroonga Adventist School,Knox Grammar School - Wahroonga Preparatory Campus,,,,,,,,,,
BONDI JUNCTION,Moriah College,"WAYS Secondary, Bondi Junction Campus",SEDA College - Margaret Whitlam Recreation Centre Campus,,,,,,,,,,,,,,,,,,,,,
LISMORE,"St Carthage's Primary School, Our Lady of Lourdes campus",Caniaba Public School,Lismore Public School,Modanville Public School,Wyrallah Road Public School,Wilson Park School,"The Rivers Secondary College, Lismore High Campus",St Carthage's Primary School,St John's College,Trinity Catholic College Lismore,"Trinity Catholic College Lismore, St Joseph's Campus",,,,,,,,,,,,,
HAMILTON,St Francis Xavier's College,Hamilton Public School,Newcastle High School,,,,,,,,,,,,,,,,,,,,,
ABERMAIN,Holy Spirit Infants School,Abermain Public School,"Aspect Hunter School, Abermain Satellite",,,,,,,,,,,,,,,,,,,,,
COMO,St Joseph's Catholic Primary School Como - Oyster Bay,Como Public School,Como West Public School,,,,,,,,,,,,,,,,,,,,,
WILCANNIA,St Therese's Community Primary School,Wilcannia Central School,,,,,,,,,,,,,,,,,,,,,,
LINDFIELD,Highfields Preparatory and Kindergarten School,Lindfield Public School,Cromehurst School,Holy Family Catholic Primary School,Newington College - Lindfield Preparatory School,,,,,,,,,,,,,,,,,,,
EAGLE VALE,"Odyssey House, Progressive Learning Centre",Eagle Vale High School,Mary Immaculate Catholic Primary School,,,,,,,,,,,,,,,,,,,,,
BONVILLE,Coffs Harbour Christian Community School,Bonville Public School,,,,,,,,,,,,,,,,,,,,,,
CHERRYBROOK,Tangara School for Girls,Cherrybrook Public School,John Purchase Public School,Cherrybrook Technology High School,,,,,,,,,,,,,,,,,,,,
PORT MACQUARIE,Heritage Christian School,Newman Senior Technical College,Port Macquarie Public School,Westport Public School,Hastings Public School,Tacking Point Public School,North East Public School of Distance Education,"Hastings Secondary College, Port Macquarie Campus","Hastings Secondary College, Westport Campus",St Agnes' Primary School,St Joseph's Primary School,St Peter's Primary School,MacKillop College Port Macquarie,St Joseph's Regional College,St Columba Anglican School,Port Macquarie Adventist School,"Aspect Hunter School, Port Macquarie Primary Satellite","Aspect Hunter School, Port Macquarie High School Satellite",Nautilus Senior College,,,,,
KINGSFORD,St Spyridon College - Junior School Campus,,,,,,,,,,,,,,,,,,,,,,,
MOUNT DRUITT,Chifley College Senior Campus,Loyola Senior High School,Colyton Public School,Mount Druitt Public School,Chifley College Mount Druitt Campus,St Bishoy Coptic Orthodox College,Australian Islamic College of Sydney,Bethel Christian School,"St Bishoy Coptic Orthodox College, St Bishoy Hall",,,,,,,,,,,,,,,
MOREE,Moree Secondary College Albert St Campus,Moree Public School,Moree East Public School,Mallawa Public School,Barwon Learning Centre,St Philomena's School,Moree Christian School,,,,,,,,,,,,,,,,,
ST MARYS,St Marys Senior High School,St Marys Public School,Oxley Park Public School,St Marys South Public School,Colyton High School,Our Lady of the Rosary Primary School,St Mary's Flexible Learning Centre,,,,,,,,,,,,,,,,,
WOY WOY,Brisbane Water Secondary College Woy Woy Campus,Woy Woy South Public School,Woy Woy Public School,"Aspect Central Coast School, Woy Woy",,,,,,,,,,,,,,,,,,,,
GLEBE,Sydney Secondary College Blackwattle Bay Campus,Glebe Public School,St James Catholic Primary School,St Scholastica's College Glebe Point,Australian Performing Arts Grammar School,,,,,,,,,,,,,,,,,,,
CASULA,All Saints Catholic Senior College,Casula Public School,Casula High School,,,,,,,,,,,,,,,,,,,,,
BOWRAVILLE,Tallowood Steiner School,Bowraville Central School,St Mary's Primary School,,,,,,,,,,,,,,,,,,,,,
NEWTOWN,Australia Street Infants School,Camdenville Public School,Newtown North Public School,Newtown Public School,Newtown High School of Performing Arts,The Athena School,,,,,,,,,,,,,,,,,,
FIVE DOCK,Russell Lea Public School,Five Dock Public School,All Hallows Catholic Primary School,Domremy Catholic College,Rosebank College,,,,,,,,,,,,,,,,,,,
PETERSHAM,Taverners Hill Infants School,Petersham Public School,Fort Street High School,,,,,,,,,,,,,,,,,,,,,
FRESHWATER,Northern Beaches Secondary College Freshwater Senior Campus,Harbord Public School,St John the Baptist Catholic Primary School,,,,,,,,,,,,,,,,,,,,,
ASHFIELD,Yeo Park Infants School,Ashfield Public School,Ashfield Boys High School,St Vincent's Catholic Primary School,Bethlehem College,"De La Salle College, Ashfield",,,,,,,,,,,,,,,,,,
MERRYLANDS,Fowler Road School,"Key College, Chapel School campus",Merrylands Public School,Sherwood Grange Public School,Merrylands East Public School,Holroyd School,Merrylands High School,Hilltop Road Public School,St Margaret Mary's Primary School,Cerdon College,,,,,,,,,,,,,,
SEFTON,Sefton Infants School,Sefton High School,Immaculate Heart of Mary Catholic Primary School,,,,,,,,,,,,,,,,,,,,,
GREENACRE,Mount Lewis Infants School,Al Noori Muslim School - Senior Campus,Greenacre Public School,Chullora Public School,Banksia Road Public School,St John Vianney Catholic Primary School,Holy Saviour School,Greenacre Baptist Christian Community School,Al Sadiq College,Al Noori Muslim School,Malek Fahd Islamic School,,,,,,,,,,,,,
BANKSTOWN,Bankstown South Infants School,Bankstown Senior College,Bankstown Hospital School,Bankstown North Public School,Condell Park Public School,Wattawa Heights Public School,Bankstown West Public School,Bankstown Public School,Bankstown Girls High School,St Felix Catholic Primary School,St Brendan's Catholic Primary School,La Salle Catholic College,"Al Amanah College, Bankstown campus",St Euphemia College,,,,,,,,,,
ARNCLIFFE,Arncliffe West Infants School,Athelstane Public School,Arncliffe Public School,St Francis Xavier's Catholic Primary School,Al Zahra College,Kingdom Culture Christian School,,,,,,,,,,,,,,,,,,
BARDWELL PARK,Bardwell Park Infants School,,,,,,,,,,,,,,,,,,,,,,,
PENSHURST,Hurstville Grove Infants School,Penshurst Public School,Georges River College Penshurst Girls Campus,St Declan's Catholic Primary School,,,,,,,,,,,,,,,,,,,,
KOTARA,Kotara School,Kotara South Public School,,,,,,,,,,,,,,,,,,,,,,
JESMOND,Callaghan College Jesmond Campus,Jesmond Public School,Heaton Public School,,,,,,,,,,,,,,,,,,,,,
NEW LAMBTON HEIGHTS,New Lambton Heights Infants School,John Hunter Hospital School,,,,,,,,,,,,,,,,,,,,,,
LORN,Nillo Infants School,,,,,,,,,,,,,,,,,,,,,,,
STANFORD MERTHYR,Stanford Merthyr Infants School,,,,,,,,,,,,,,,,,,,,,,,
GLEN INNES,Glen Innes West Infants School,Glen Innes Public School,Wytaliba Public School,Glen Innes High School,St Joseph's Primary School,,,,,,,,,,,,,,,,,,,
RUGBY,Rugby Public School,,,,,,,,,,,,,,,,,,,,,,,
CABRAMURRA,Cabramurra Public School,,,,,,,,,,,,,,,,,,,,,,,
NARRANDERA,Narrandera East Infants School,Narrandera Public School,Narrandera High School,St Joseph's Primary School,,,,,,,,,,,,,,,,,,,,
JUGIONG,Jugiong Public School,,,,,,,,,,,,,,,,,,,,,,,
SOFALA,Sofala Public School,,,,,,,,,,,,,,,,,,,,,,,
GOOLMA,Goolma Public School,,,,,,,,,,,,,,,,,,,,,,,
MOSS VALE,St Paul's International College,Moss Vale Public School,Moss Vale High School,St Paul's Catholic Primary School,Tudor House,,,,,,,,,,,,,,,,,,,
CRONULLA,"De La Salle Catholic College, Cronulla",Cronulla Public School,Cronulla South Public School,Woolooware Public School,Burraneer Bay Public School,Cronulla High School,St Aloysius Catholic Primary School,Our Lady of Mercy Catholic College Burraneer,,,,,,,,,,,,,,,,
MAITLAND,All Saints College (St Mary's Campus),Telarah Public School,Maitland Public School,St John the Baptist Primary School,All Saints College (St Peter's Campus),All Saints College (St Mary's Campus) - St Peter's Campus,,,,,,,,,,,,,,,,,,
PORT KEMBLA,Five Islands Secondary College,Port Kembla Public School,Kemblawarra Public School,St Patrick's Catholic Primary School,,,,,,,,,,,,,,,,,,,,
COFFS HARBOUR,Coffs Harbour Senior College,Coffs Harbour Public School,Narranga Public School,Tyalla Public School,Coffs Harbour High School,Orara High School,St Augustine's Primary School,St John Paul College,Coffs Harbour Christian Community School - Junior Campus,Bishop Druitt College,Casuarina Steiner School,"Aspect Macarthur School, Northern Rivers, Coffs Harbour",Lismore Diocese Online Education Centre,Coffs Coast Alesco School,,,,,,,,,,
EAST RYDE,Field of Mars Environmental Education Centre,,,,,,,,,,,,,,,,,,,,,,,
ST LEONARDS,Bradfield College,Royal North Shore Hospital School,,,,,,,,,,,,,,,,,,,,,,
SURRY HILLS,Australian Institute of Music,Crown Street Public School,Sydney Distance Education Primary School,Bourke Street Public School,Sydney Boys High School,Sydney Girls High School,Central Sydney Intensive English High School,,,,,,,,,,,,,,,,,
HEBERSHAM,Blacktown Youth College Incorporated,Hebersham Public School,,,,,,,,,,,,,,,,,,,,,,
QUAKERS HILL,Wyndham College,St John Paul II Catholic College (Nirimba),Quakers Hill Public School,Hambledon Public School,Barnier Public School,Quakers Hill High School,Mary Immaculate Primary School,,,,,,,,,,,,,,,,,
NORTH RYDE,Arndell School,North Ryde Public School,Truscott Street Public School,Ryde East Public School,Holy Spirit Catholic Primary School,The Children's House Montessori,,,,,,,,,,,,,,,,,,
CAMPERDOWN,Bridge Road School,Royal Prince Alfred Hospital School,,,,,,,,,,,,,,,,,,,,,,
KARIONG,Girrakool School,Kariong Public School,Kariong Mountains High School,International Football and Tennis School,Ngaruki Gulgul,,,,,,,,,,,,,,,,,,,
CAMPBELLTOWN,Dorchester School,Campbelltown Public School,Kentlyn Public School,Campbelltown North Public School,Campbelltown East Public School,Briar Road Public School,Woodland Road Public School,Beverley Park School,Lomandra School,Campbelltown Performing Arts High School,Airds High School,St John the Evangelist Catholic Primary School,St Thomas More Catholic Primary School,"St Patrick's College, Campbelltown",St Peter's Anglican Primary School,"Aspect Macarthur School, Campbelltown",,,,,,,,
WERRINGTON,Putland School,Montgrove College - Werrington Campus,Werrington Public School,Werrington County Public School,Kurrambee School,Penrith Valley Learning Centre,Wollemi College,,,,,,,,,,,,,,,,,
TAMWORTH,Calrossy Anglican School,Tamworth Public School,Oxley Vale Public School,Tamworth South Public School,Hillvue Public School,Peel High School,St Nicholas' Primary School,Liberty College,Carinya Christian School Tamworth,Calrossy Anglican School - Brisbane St Campus,Calrossy Anglican School - Gloria Thew House Campus,Calrossy Anglican School - Simpson House Campus,Calrossy Anglican School - Tangara Campus,,,,,,,,,,,
TUNCURRY,Great Lakes College Senior Campus,Tuncurry Public School,Great Lakes College Tuncurry Campus,Alesco Senior College - Coast Campus,,,,,,,,,,,,,,,,,,,,
OATLEY,Georges River College Oatley Senior Campus,Oatley Public School,Oatley West Public School,St Joseph's Catholic Primary School,,,,,,,,,,,,,,,,,,,,
SOUTH GRAFTON,Induna School,South Grafton Public School,Gillwinga Public School,South Grafton High School,St Joseph's Primary School,,,,,,,,,,,,,,,,,,,
AVALON BEACH,Barrenjoey Montessori School,Avalon Public School,Barrenjoey High School,Maria Regina Catholic Primary School,,,,,,,,,,,,,,,,,,,,
RANDWICK,Centennial Park School,NSW School of Languages,Sydney Childrens Hospital School,Rainbow Street Public School,Randwick Public School,Randwick Boys High School,Randwick Girls High School,Our Lady of the Sacred Heart Catholic Primary School,Brigidine College Randwick,Marcellin College,The Joseph Varga School,Claremont College,Emanuel School,Coogee Boys' Preparatory School,,,,,,,,,,
DUBBO,Dubbo College Senior Campus,Lincoln School,Wambangalang Environmental Education Centre,Dubbo Public School,Dubbo North Public School,Dubbo South Public School,Dubbo West Public School,Orana Heights Public School,Dubbo School of Distance Education,Buninyong Public School,Mian School,Dubbo College South Campus,St John's Catholic Primary School,St Pius X Catholic Primary School,St Mary's Catholic Primary School,St Laurence's Catholic Primary School,St Johns College,Dubbo Christian School,Macquarie Anglican Grammar School,Burrabadine Cornerstone Christian School,Western College ALESCO Learning Centre,"Western College ALESCO Learning Centre, White Street Campus",,
WAKEFIELD,Wakefield School,,,,,,,,,,,,,,,,,,,,,,,
FAIRFIELD EAST,Verona School,Villawood North Public School,,,,,,,,,,,,,,,,,,,,,,
WESTMEAD,Palm Avenue School,The Childrens Hospital School,Westmead Public School,Redbank School,Sacred Heart Primary School,Catherine McAuley Westmead,Parramatta Marist High School,Westmead Christian Grammar School,Mother Teresa Primary School,,,,,,,,,,,,,,,
SYDNEY,Oxford College - Sydney,Holmes Secondary College,Fort Street Public School,Conservatorium High School,St Mary's Cathedral College,St Andrew's Cathedral School,Macquarie Grammar School,St Andrew's Cathedral Gawura School,Australian International High School,St Andrew's Cathedral School - Bishop Barry Senior College,,,,,,,,,,,,,,
CASTLECRAG,Castlecrag Montessori School,"Glenaeon Rudolf Steiner School, Castlecrag",,,,,,,,,,,,,,,,,,,,,,
YAGOONA,Al Sadiq College Yagoona Campus,Yagoona Public School,Christ the King Catholic School Bass Hill,,,,,,,,,,,,,,,,,,,,,
WARNERVALE,Lakes Grammar - An Anglican School,MacKillop Catholic College,,,,,,,,,,,,,,,,,,,,,,
COOKS HILL,Alesco Senior College,"Newcastle Grammar School, Park Campus",,,,,,,,,,,,,,,,,,,,,,
MANLY,Royal Far West School,Manly Village Public School,St Mary's Catholic Primary School,St Paul's Catholic College,Stella Maris College,Stella Maris College - Benedict Campus,Headland Montessori Elc,,,,,,,,,,,,,,,,,
CURL CURL,Stewart House School,,,,,,,,,,,,,,,,,,,,,,,
GULGONG,Red Hill Environmental Education Centre,Gulgong Public School,Gulgong High School,All Hallows Catholic Primary School,,,,,,,,,,,,,,,,,,,,
ARMIDALE,Thalgarrah Environmental Education Centre,Armidale City Public School,Drummond Memorial Public School,Ben Venue Public School,Kellys Plains Public School,Martins Gully Public School,Newling Public School,Sandon Public School,Armidale High School,Duval High School,St Mary's Primary School,O'Connor Catholic College,Minimbah Primary School,The Armidale Waldorf School,"M.E.T. School, Armidale campus",The Armidale School,New England Girls' School,PLC Armidale,"The Armidale School, Peter Hall Trade Training in Schools Centre",,,,,
DUDLEY,Awabakal Environmental Education Centre,Dudley Public School,,,,,,,,,,,,,,,,,,,,,,
KURNELL,Botany Bay Environmental Education Centre,Kurnell Public School,,,,,,,,,,,,,,,,,,,,,,
KALARU,Bournda Environmental Education Centre,,,,,,,,,,,,,,,,,,,,,,,
SACKVILLE NORTH,Brewongle Environmental Education Centre,,,,,,,,,,,,,,,,,,,,,,,
MENANGLE,Camden Park Environmental Education Centre,,,,,,,,,,,,,,,,,,,,,,,
CASCADE,Cascade Environmental Education Centre,,,,,,,,,,,,,,,,,,,,,,,
DORROUGHBY,Dorroughby Environmental Education Centre,,,,,,,,,,,,,,,,,,,,,,,
CHIPPING NORTON,Georges River Environmental Education Centre,Chipping Norton Public School,,,,,,,,,,,,,,,,,,,,,,
BOBBIN HEAD,Gibberagong Environmental Education Centre,,,,,,,,,,,,,,,,,,,,,,,
DUNMORE,Illawarra Environmental Education Centre,Shellharbour Anglican College,,,,,,,,,,,,,,,,,,,,,,
MARAYLYA,Longneck Lagoon Environmental Education Centre,Maraylya Public School,,,,,,,,,,,,,,,,,,,,,,
MILLERS POINT,Observatory Hill Environmental Education Centre,,,,,,,,,,,,,,,,,,,,,,,
CRANEBROOK,Penrith Lakes Environmental Education Centre,Braddock Public School,Samuel Terry Public School,Henry Fulton Public School,Cranebrook High School,Corpus Christi Primary School,St Paul's Grammar School,,,,,,,,,,,,,,,,,
AUDLEY,Royal National Park Environmental Education Centre,,,,,,,,,,,,,,,,,,,,,,,
GOSFORD,Rumbalara Environmental Education Centre,Somersby Public School,Gosford High School,Henry Kendall High School,ET Australia Secondary College,,,,,,,,,,,,,,,,,,,
COONABARABRAN,Warrumbungle National Park Environmental Education Centre,Coonabarabran Public School,Coonabarabran High School,St Lawrence's Catholic Primary School,,,,,,,,,,,,,,,,,,,,
SHORTLAND,Wetlands Environmental Education Centre,Shortland Public School,Our Lady of Victories Primary School,Margaret Jurd College,,,,,,,,,,,,,,,,,,,,
OAKDALE,Wooglemai Environmental Education Centre,Oakdale Public School,,,,,,,,,,,,,,,,,,,,,,
WOODBERRY,Woodberry Learning Centre,Woodberry Public School,,,,,,,,,,,,,,,,,,,,,,
FAIRFIELD,Warakirri College,Fairfield Public School,Fairfield Heights Public School,Fairvale Public School,Fairfield High School,Our Lady of the Rosary Catholic Primary School,Patrician Brothers' College Fairfield,,,,,,,,,,,,,,,,,
TELARAH,Hunter Trade College,,,,,,,,,,,,,,,,,,,,,,,
KOGARAH,St George Hospital School,Kogarah Public School,St George School,St George Girls High School,Moorefield Girls High School,Kogarah High School,James Cook Boys High School,St Patrick's Catholic Primary School,,,,,,,,,,,,,,,,
CARINGBAH,Sutherland Hospital School,Caringbah Public School,Caringbah North Public School,Laguna Street Public School,Caringbah High School,Endeavour Sports High School,Our Lady of Fatima Catholic Primary School,"De La Salle Catholic College, Caringbah",,,,,,,,,,,,,,,,
WOLLONGONG,Illawarra Hospital School,Wollongong West Public School,Mount St Thomas Public School,Wollongong Public School,Lindsay Park Public School,Smiths Hill High School,St Mary Star of the Sea College,ALESCO Illawarra,,,,,,,,,,,,,,,,
