CHATSWOOD,Chatswood Public School,Chatswood High School,Our Lady of Dolours Catholic Primary School,Mercy Catholic College,St Pius X College,International Chinese School,,,,,,,,,,,,,,,,,,
CROWS NEST,North Sydney Boys High School,North Sydney Girls High School,Cammeraygal High School,,,,,,,,,,,,,,,,,,,,,
SOUTH TURRAMURRA,Turramurra High School,,,,,,,,,,,,,,,,,,,,,,,
APPIN,Appin Public School,,,,,,,,,,,,,,,,,,,,,,,
AUSTRAL,Austral Public School,Unity Grammar College,Al-Faisal College - Liverpool,St Anthony of Padua Catholic School,,,,,,,,,,,,,,,,,,,,
BARGO,Bargo Public School,,,,,,,,,,,,,,,,,,,,,,,
BASS HILL,Bass Hill Public School,Bass High School,George Bass School,,,,,,,,,,,,,,,,,,,,,
BERALA,Berala Public School,,,,,,,,,,,,,,,,,,,,,,,
GRANVILLE,Blaxcell Street Public School,Granville Public School,Granville East Public School,Granville Boys High School,Holy Trinity Primary School,Delany College,,,,,,,,,,,,,,,,,,
BOSSLEY PARK,Bossley Park Public School,Prairievale Public School,Bossley Park High School,Mary Immaculate Catholic Primary School,,,,,,,,,,,,,,,,,,,,
BRINGELLY,Bringelly Public School,,,,,,,,,,,,,,,,,,,,,,,
BURWOOD,Burwood Public School,MLC School,Southern Cross Catholic Vocational College,"MLC School, Art and Design Centre","MLC School, Music Centre",,,,,,,,,,,,,,,,,,,
BUXTON,Buxton Public School,,,,,,,,,,,,,,,,,,,,,,,
CABRAMATTA,Cabramatta Public School,Cabramatta West Public School,Harrington Street Public School,Lansvale East Public School,Cabramatta High School,Sacred Heart Catholic School,,,,,,,,,,,,,,,,,,
CAMDEN,Camden Public School,Cawdor Public School,Mount Hunter Public School,Camden South Public School,Mawarra Public School,Camden High School,St Paul's Catholic Primary School,Mater Dei School,,,,,,,,,,,,,,,,
CAMPSIE,Campsie Public School,Harcourt Public School,Wangee Park School,St Mel's Catholic Primary School,,,,,,,,,,,,,,,,,,,,
CANLEY VALE,Canley Vale Public School,Lansvale Public School,Canley Vale High School,Pal Buddhist School,,,,,,,,,,,,,,,,,,,,
COBBITTY,Cobbitty Public School,Macarthur Anglican School,Aspect Macarthur School,,,,,,,,,,,,,,,,,,,,,
CONCORD,Concord Public School,Mortlake Public School,Concord High School,St Mary's Catholic Primary School,,,,,,,,,,,,,,,,,,,,
CONCORD WEST,Concord West Public School,Rivendell School,St Ambrose Catholic Primary School,Victoria Avenue Public School,,,,,,,,,,,,,,,,,,,,
DOUGLAS PARK,Douglas Park Public School,,,,,,,,,,,,,,,,,,,,,,,
PANANIA,Panania Public School,East Hills Public School,Panania North Public School,Tower Street Public School,East Hills Girls Technology High School,East Hills Boys High School,Picnic Point High School,St Christopher's Catholic Primary School,,,,,,,,,,,,,,,,
ENFIELD,Enfield Public School,Strathfield South High School,St Joseph's Catholic Primary School,,,,,,,,,,,,,,,,,,,,,
FAIRFIELD WEST,Fairfield West Public School,Westfields Sports High School,Fairvale High School,,,,,,,,,,,,,,,,,,,,,
GLENFIELD,Glenfield Public School,Glenwood Public School,Glenfield Park School,Campbell House School,Ajuga School,Hurlstone Agricultural High School,,,,,,,,,,,,,,,,,,
GUILDFORD,Granville South Public School,Guildford Public School,Old Guildford Public School,Granville South Creative and Performing Arts High School,St Patrick's Primary School,,,,,,,,,,,,,,,,,,,
GREEN VALLEY,Green Valley Public School,Busby West Public School,James Busby High School,Green Valley Islamic College,,,,,,,,,,,,,,,,,,,,
HAMMONDVILLE,Hammondville Public School,,,,,,,,,,,,,,,,,,,,,,,
HOMEBUSH,Homebush Public School,Homebush Boys High School,,,,,,,,,,,,,,,,,,,,,,
HORSLEY PARK,Horsley Park Public School,Marion Catholic Primary School,,,,,,,,,,,,,,,,,,,,,,
HOXTON PARK,Hoxton Park Public School,Good Shepherd Catholic Primary School,Malek Fahd Hoxton Park,,,,,,,,,,,,,,,,,,,,,
INGLEBURN,Ingleburn Public School,Sackville Street Public School,Ingleburn High School,Holy Family Catholic Primary School,"Odyssey House, Progressive Learning Centre, Ingleburn",,,,,,,,,,,,,,,,,,,
LAKEMBA,Lakemba Public School,Hampden Park Public School,Canterbury Vale School,St Therese's Catholic Primary School,Holy Spirit Catholic College,Rissalah College,Al Hikma College,,,,,,,,,,,,,,,,,
LIDCOMBE,Lidcombe Public School,St Joachim's Catholic Primary School,,,,,,,,,,,,,,,,,,,,,,
MILPERRA,Milperra Public School,Mount St Joseph Milperra,,,,,,,,,,,,,,,,,,,,,,
MINTO,Minto Public School,Campbellfield Public School,Sarah Redfern Public School,The Grange Public School,Passfield Park School,Sarah Redfern High School,"Aspect Macarthur School, Minto",Al-Faisal College - Campbelltown,,,,,,,,,,,,,,,,
MOUNT PRITCHARD,Mount Pritchard Public School,Mount Pritchard East Public School,Les Powell School,,,,,,,,,,,,,,,,,,,,,
NARELLAN,Narellan Public School,Elizabeth Macarthur High School,Magdalene Catholic High School,,,,,,,,,,,,,,,,,,,,,
THE OAKS,The Oaks Public School,,,,,,,,,,,,,,,,,,,,,,,
PADSTOW,Padstow Park Public School,Padstow Heights Public School,Padstow North Public School,Caroline Chisholm School,St Therese Catholic Primary School,,,,,,,,,,,,,,,,,,,
PICTON,Picton Public School,Picton High School,St Anthony's Catholic Primary School,,,,,,,,,,,,,,,,,,,,,
PRESTONS,Prestons Public School,Dalmeny Public School,St Catherine of Siena Catholic Primary School,William Carey Christian School,"Amity College, Prestons",,,,,,,,,,,,,,,,,,,
PUNCHBOWL,Punchbowl Public School,Punchbowl Boys High School,Wiley Park Girls High School,St Jerome's Catholic Primary School,St Charbel's College,,,,,,,,,,,,,,,,,,,
LEPPINGTON,Leppington Public School,,,,,,,,,,,,,,,,,,,,,,,
REVESBY,Revesby Public School,Revesby South Public School,Broderick Gillawarna School,Sir Joseph Banks High School,St Luke's Catholic Primary School,,,,,,,,,,,,,,,,,,,
ROSSMORE,Rossmore Public School,Bellfield College,,,,,,,,,,,,,,,,,,,,,,
ST JOHNS PARK,St Johns Park Public School,King Park Public School,St Johns Park High School,,,,,,,,,,,,,,,,,,,,,
SMITHFIELD,Smithfield Public School,St Gertrude's Catholic Primary School,"Aspect Western Sydney School, Smithfield",,,,,,,,,,,,,,,,,,,,,
NORTH STRATHFIELD,Strathfield North Public School,The McDonald College,Our Lady of the Assumption Catholic Primary School,,,,,,,,,,,,,,,,,,,,,
STRATHFIELD SOUTH,Strathfield South Public School,St Anne's Catholic Primary School,,,,,,,,,,,,,,,,,,,,,,
TAHMOOR,Tahmoor Public School,Wollondilly Anglican College,,,,,,,,,,,,,,,,,,,,,,
THIRLMERE,Thirlmere Public School,,,,,,,,,,,,,,,,,,,,,,,
CARRAMAR,Carramar Public School,,,,,,,,,,,,,,,,,,,,,,,
YANDERRA,Yanderra Public School,,,,,,,,,,,,,,,,,,,,,,,
KEMPS CREEK,Kemps Creek Public School,Trinity Catholic Primary School,Emmaus Catholic College,Christadelphian Heritage College Sydney,"Aspect Western Sydney School, Kemps Creek - Emmaus","Aspect Western Sydney School, Kemps Creek - Trinity",,,,,,,,,,,,,,,,,,
WARWICK FARM,Warwick Farm Public School,Lawrence Hargrave School,,,,,,,,,,,,,,,,,,,,,,
CHESTER HILL,Chester Hill Public School,Chester Hill North Public School,Chester Hill High School,Salamah College,,,,,,,,,,,,,,,,,,,,
GEORGES HALL,Georges Hall Public School,St Mary's Catholic Primary School,Georges River Grammar,HopePoint Christian School,,,,,,,,,,,,,,,,,,,,
RIVERWOOD,Riverwood Public School,Hannans Road Public School,St Joseph's Catholic Primary School,Southside Montessori School,,,,,,,,,,,,,,,,,,,,
WATTLE GROVE,Wattle Grove Public School,St Mark's Coptic Orthodox College,,,,,,,,,,,,,,,,,,,,,,
NARWEE,Narwee Public School,,,,,,,,,,,,,,,,,,,,,,,
VILLAWOOD,Villawood East Public School,Sacred Heart Catholic Primary School,,,,,,,,,,,,,,,,,,,,,,
CANLEY HEIGHTS,Canley Heights Public School,,,,,,,,,,,,,,,,,,,,,,,
YENNORA,Yennora Public School,,,,,,,,,,,,,,,,,,,,,,,
GUILDFORD WEST,Guildford West Public School,,,,,,,,,,,,,,,,,,,,,,,
BIRRONG,Birrong Public School,Birrong Boys High School,Birrong Girls High School,,,,,,,,,,,,,,,,,,,,,
LEUMEAH,Leumeah Public School,Leumeah High School,,,,,,,,,,,,,,,,,,,,,,
MACQUARIE FIELDS,Macquarie Fields Public School,Curran Public School,Guise Public School,James Meehan High School,Macquarie Fields High School,Macarthur Adventist College,EDEN College,,,,,,,,,,,,,,,,,
HOLSWORTHY,Holsworthy Public School,Holsworthy High School,St Christopher's Catholic Primary School,"Aspect Macarthur School, Holsworthy",,,,,,,,,,,,,,,,,,,,
LURNEA,Lurnea Public School,Lurnea High School,St Francis Xavier's Catholic Primary School,,,,,,,,,,,,,,,,,,,,,
BARDIA,Bardia Public School,,,,,,,,,,,,,,,,,,,,,,,
GREYSTANES,Ringrose Public School,Widemere Public School,Holroyd High School,Greystanes Public School,Beresford Road Public School,Greystanes High School,Our Lady Queen of Peace Primary School,St Paul's Catholic College,,,,,,,,,,,,,,,,
SADLEIR,Sadleir Public School,,,,,,,,,,,,,,,,,,,,,,,
HECKENBERG,Heckenberg Public School,,,,,,,,,,,,,,,,,,,,,,,
BUSBY,Busby Public School,,,,,,,,,,,,,,,,,,,,,,,
MILLER,Miller Public School,Miller High School,,,,,,,,,,,,,,,,,,,,,,
PICNIC POINT,Picnic Point Public School,,,,,,,,,,,,,,,,,,,,,,,
ASHCROFT,Ashcroft Public School,Ashcroft High School,,,,,,,,,,,,,,,,,,,,,,
WETHERILL PARK,Smithfield West Public School,William Stimson Public School,Prairiewood High School,Aspect Western Sydney School,,,,,,,,,,,,,,,,,,,,
CARTWRIGHT,Cartwright Public School,,,,,,,,,,,,,,,,,,,,,,,
BRADBURY,Bradbury Public School,Sherwood Hills Christian School,,,,,,,,,,,,,,,,,,,,,,
MOOREBANK,Nuwarra Public School,Newbridge Heights Public School,Moorebank High School,St Joseph's Catholic Primary School,,,,,,,,,,,,,,,,,,,,
AIRDS,John Warby Public School,,,,,,,,,,,,,,,,,,,,,,,
ST ANDREWS,St Andrews Public School,,,,,,,,,,,,,,,,,,,,,,,
RUSE,Ruse Public School,,,,,,,,,,,,,,,,,,,,,,,
AMBARVALE,Ambarvale Public School,Thomas Acres Public School,Thomas Reddall High School,,,,,,,,,,,,,,,,,,,,,
CLAYMORE,Claymore Public School,,,,,,,,,,,,,,,,,,,,,,,
BLAIRMOUNT,Blairmount Public School,,,,,,,,,,,,,,,,,,,,,,,
ROSEMEADOW,Rosemeadow Public School,Mary Brooksbank School,Ambarvale High School,John Therry Catholic High School,Our Lady Help of Christians Catholic Primary School,,,,,,,,,,,,,,,,,,,
BONNYRIGG,Bonnyrigg Public School,Bonnyrigg High School,Our Lady of Mt Carmel Catholic Primary School Mount Pritchard,,,,,,,,,,,,,,,,,,,,,
WILEY PARK,Wiley Park Public School,,,,,,,,,,,,,,,,,,,,,,,
ESCHOL PARK,Eschol Park Public School,,,,,,,,,,,,,,,,,,,,,,,
EDENSOR PARK,Governor Philip King Public School,Edensor Park Public School,St Narsai Assyrian Christian College,,,,,,,,,,,,,,,,,,,,,
RABY,Robert Townson Public School,Robert Townson High School,,,,,,,,,,,,,,,,,,,,,,
KEARNS,Kearns Public School,,,,,,,,,,,,,,,,,,,,,,,
BONNYRIGG HEIGHTS,Bonnyrigg Heights Public School,John the Baptist Catholic Primary School,Freeman Catholic College,,,,,,,,,,,,,,,,,,,,,
MOUNT ANNAN,Mount Annan Public School,Mount Annan High School,Mount Annan Christian College,,,,,,,,,,,,,,,,,,,,,
ST HELENS PARK,St Helens Park Public School,,,,,,,,,,,,,,,,,,,,,,,
HINCHINBROOK,Hinchinbrook Public School,Hoxton Park High School,Good Samaritan Catholic College,,,,,,,,,,,,,,,,,,,,,
NARELLAN VALE,Narellan Vale Public School,St Clare's Catholic Primary School,,,,,,,,,,,,,,,,,,,,,,
CARNES HILL,Greenway Park Public School,Holy Spirit Catholic Primary School,,,,,,,,,,,,,,,,,,,,,,
CURRANS HILL,Currans Hill Public School,,,,,,,,,,,,,,,,,,,,,,,
NEWINGTON,Newington Public School,SEDA College - Sydney Olympic Park Campus,,,,,,,,,,,,,,,,,,,,,,
HARRINGTON PARK,Harrington Park Public School,,,,,,,,,,,,,,,,,,,,,,,
CECIL HILLS,Cecil Hills Public School,Cecil Hills High School,,,,,,,,,,,,,,,,,,,,,,
ELDERSLIE,Elderslie Public School,Elderslie High School,,,,,,,,,,,,,,,,,,,,,,
MIDDLETON GRANGE,Middleton Grange Public School,Thomas Hassall Anglican College,,,,,,,,,,,,,,,,,,,,,,
HOMEBUSH WEST,Homebush West Public School,,,,,,,,,,,,,,,,,,,,,,,
CANADA BAY,Lucas Gardens School,,,,,,,,,,,,,,,,,,,,,,,
HORNINGSEA PARK,John Edmondson High School,,,,,,,,,,,,,,,,,,,,,,,
CONDELL PARK,Condell Park High School,Condell Park Christian School,,,,,,,,,,,,,,,,,,,,,,
BILPIN,Bilpin Public School,,,,,,,,,,,,,,,,,,,,,,,
BLACKHEATH,Blackheath Public School,Mountains Christian College,,,,,,,,,,,,,,,,,,,,,,
BLAXLAND,Blaxland Public School,Blaxland High School,,,,,,,,,,,,,,,,,,,,,,
COLO HEIGHTS,Colo Heights Public School,,,,,,,,,,,,,,,,,,,,,,,
NORTH PARRAMATTA,Burnside Public School,Parramatta North Public School,St Monica's Primary School,Tara Anglican School for Girls,Redeemer Baptist School,The King's School,,,,,,,,,,,,,,,,,,
CATTAI,Cattai Public School,,,,,,,,,,,,,,,,,,,,,,,
KURRAJONG,Comleroy Road Public School,Kurrajong Public School,Kuyper Christian School,Hawkesbury Independent School,,,,,,,,,,,,,,,,,,,,
DOONSIDE,Doonside Public School,Crawford Public School,Doonside High School,St John Vianney's Primary School,Mountain View Adventist College,,,,,,,,,,,,,,,,,,,
EASTERN CREEK,Eastern Creek Public School,,,,,,,,,,,,,,,,,,,,,,,
EBENEZER,Ebenezer Public School,,,,,,,,,,,,,,,,,,,,,,,
EMU PLAINS,Emu Plains Public School,Emu Heights Public School,Leonay Public School,Nepean Creative and Performing Arts High School,Our Lady of the Way Primary School,McCarthy Catholic College (Emu Plains),,,,,,,,,,,,,,,,,,
FREEMANS REACH,Freemans Reach Public School,Hawkesbury High School,,,,,,,,,,,,,,,,,,,,,,
GIRRAWEEN,Girraween Public School,Girraween High School,St Anthony's Primary School,,,,,,,,,,,,,,,,,,,,,
GLENBROOK,Glenbrook Public School,Lapstone Public School,St Finbar's Primary School,,,,,,,,,,,,,,,,,,,,,
GLOSSODIA,Glossodia Public School,,,,,,,,,,,,,,,,,,,,,,,
KINGSWOOD,Kingswood Public School,Kingswood South Public School,Kingswood High School,St Joseph's Primary School,St Dominic's College,,,,,,,,,,,,,,,,,,,
KURMOND,Kurmond Public School,,,,,,,,,,,,,,,,,,,,,,,
EAST KURRAJONG,Kurrajong East Public School,,,,,,,,,,,,,,,,,,,,,,,
KURRAJONG HILLS,Kurrajong North Public School,,,,,,,,,,,,,,,,,,,,,,,
LEURA,Leura Public School,,,,,,,,,,,,,,,,,,,,,,,
LLANDILO,Llandilo Public School,Xavier College,,,,,,,,,,,,,,,,,,,,,,
LONDONDERRY,Londonderry Public School,,,,,,,,,,,,,,,,,,,,,,,
LUDDENHAM,Luddenham Public School,Holy Family Primary School,,,,,,,,,,,,,,,,,,,,,,
CENTRAL MACDONALD,Macdonald Valley Public School,,,,,,,,,,,,,,,,,,,,,,,
MAROOTA,Maroota Public School,,,,,,,,,,,,,,,,,,,,,,,
MARSDEN PARK,Marsden Park Public School,St Luke's Catholic College (Primary),"Richard Johnson Anglican School, Marsden Park campus",,,,,,,,,,,,,,,,,,,,,
SEVEN HILLS,The Meadows Public School,Seven Hills North Public School,Seven Hills Public School,Seven Hills West Public School,Bert Oldfield Public School,Vardys Road Public School,William Rose School,Seven Hills High School,The Hills Sports High School,Our Lady of Lourdes Primary School,,,,,,,,,,,,,,
MEGALONG VALLEY,Megalong Public School,,,,,,,,,,,,,,,,,,,,,,,
MOUNT VICTORIA,Mount Victoria Public School,"M.E.T. School, Mount Victoria campus",,,,,,,,,,,,,,,,,,,,,,
MULGOA,Mulgoa Public School,Nepean Christian School,,,,,,,,,,,,,,,,,,,,,,
NORTHMEAD,Northmead Public School,The Hills School,Northmead Creative and Performing Arts High School,,,,,,,,,,,,,,,,,,,,,
OAKVILLE,Oakville Public School,Arndell Anglican College,,,,,,,,,,,,,,,,,,,,,,
ORCHARD HILLS,Orchard Hills Public School,Penrith Christian School,Penrith Anglican College,Montgrove College,,,,,,,,,,,,,,,,,,,,
PARRAMATTA,Parramatta Public School,Parramatta West Public School,Parramatta East Public School,Rowland Hassall School,Parramatta High School,Macarthur Girls High School,Arthur Phillip High School,St Patrick's Primary School,Our Lady of Mercy College Parramatta,,,,,,,,,,,,,,,
PITT TOWN,Pitt Town Public School,,,,,,,,,,,,,,,,,,,,,,,
PLUMPTON,Plumpton Public School,Plumpton House School,Plumpton High School,Good Shepherd Primary School,Western Grammar School,,,,,,,,,,,,,,,,,,,
REGENTVILLE,Regentville Public School,,,,,,,,,,,,,,,,,,,,,,,
NORTH RICHMOND,Richmond North Public School,Colo High School,,,,,,,,,,,,,,,,,,,,,,
ROUSE HILL,Rouse Hill Public School,Ironbark Ridge Public School,Rouse Hill High School,Rouse Hill Anglican College,,,,,,,,,,,,,,,,,,,,
RYDALMERE,Rydalmere Public School,St Mary's Primary School,,,,,,,,,,,,,,,,,,,,,,
SCHOFIELDS,Schofields Public School,St Joseph's Primary School,St John Paul II Catholic College (Schofields),"Aspect Western Sydney School, Schofields","Aspect Western Sydney School, St Joseph's",,,,,,,,,,,,,,,,,,,
SPRINGWOOD,Springwood Public School,Ellison Public School,Springwood High School,St Thomas Aquinas Primary School,St Columba's Catholic College,"Aspect Western Sydney School, Springwood","Aspect Western Sydney School, St Thomas Aquinas",,,,,,,,,,,,,,,,,
TOONGABBIE,Toongabbie Public School,Toongabbie West Public School,Metella Road Public School,Toongabbie Christian School,,,,,,,,,,,,,,,,,,,,
VINEYARD,Vineyard Public School,,,,,,,,,,,,,,,,,,,,,,,
WALLACIA,Wallacia Public School,,,,,,,,,,,,,,,,,,,,,,,
WENTWORTH FALLS,Wentworth Falls Public School,Kindlehill School,Blue Mountains Grammar School,,,,,,,,,,,,,,,,,,,,,
WENTWORTHVILLE,Wentworthville Public School,Pendle Hill Public School,Darcy Road Public School,Toongabbie East Public School,Pendle Hill High School,Our Lady of Mount Carmel Primary School,,,,,,,,,,,,,,,,,,
WILBERFORCE,Wilberforce Public School,,,,,,,,,,,,,,,,,,,,,,,
WINDSOR,Windsor Public School,St Matthew's Primary School,,,,,,,,,,,,,,,,,,,,,,
WISEMANS FERRY,Wisemans Ferry Public School,,,,,,,,,,,,,,,,,,,,,,,
WARRAGAMBA,Warragamba Public School,,,,,,,,,,,,,,,,,,,,,,,
HAZELBROOK,Hazelbrook Public School,Blue Mountains Steiner School,Korowal School,,,,,,,,,,,,,,,,,,,,,
KATOOMBA,Katoomba North Public School,Katoomba Public School,Katoomba High School,St Canice's Primary School,,,,,,,,,,,,,,,,,,,,
RICHMOND,Richmond Public School,Richmond High School,St Monica's Primary School,"Aspect Western Sydney School, Bourke Street, Richmond","Aspect Western Sydney School, Windsor Street, Richmond",,,,,,,,,,,,,,,,,,,
DUNDAS,Dundas Public School,St Patrick's Marist College,,,,,,,,,,,,,,,,,,,,,,
ROOTY HILL,Rooty Hill Public School,Rooty Hill High School,St Aidan's Primary School,St Agnes Catholic High School,,,,,,,,,,,,,,,,,,,,
CAMBRIDGE PARK,Cambridge Park Public School,Cambridge Gardens Public School,Cambridge Park High School,,,,,,,,,,,,,,,,,,,,,
SOUTH WINDSOR,Windsor South Public School,Windsor Park Public School,Bede Polding College,,,,,,,,,,,,,,,,,,,,,
OATLANDS,Oatlands Public School,Meadowbank Education Trust School,,,,,,,,,,,,,,,,,,,,,,
TELOPEA,Telopea Public School,,,,,,,,,,,,,,,,,,,,,,,
ERMINGTON,Rydalmere East Public School,Ermington West Public School,,,,,,,,,,,,,,,,,,,,,,
CASTLEREAGH,Castlereagh Public School,The Lakes Christian College,,,,,,,,,,,,,,,,,,,,,,
DUNDAS VALLEY,Yates Avenue Public School,St Bernadette's Primary School,,,,,,,,,,,,,,,,,,,,,,
LALOR PARK,Lalor Park Public School,St Bernadette's Primary School,,,,,,,,,,,,,,,,,,,,,,
WARRIMOO,Warrimoo Public School,Wycliffe Christian School,,,,,,,,,,,,,,,,,,,,,,
NORTH ST MARYS,St Marys North Public School,Chifley College Dunheved Campus,,,,,,,,,,,,,,,,,,,,,,
ACACIA GARDENS,Quakers Hill East Public School,,,,,,,,,,,,,,,,,,,,,,,
COLYTON,Bennett Road Public School,,,,,,,,,,,,,,,,,,,,,,,
BLAXLAND EAST,Blaxland East Public School,,,,,,,,,,,,,,,,,,,,,,,
FAULCONBRIDGE,Faulconbridge Public School,,,,,,,,,,,,,,,,,,,,,,,
WHALAN,Whalan Public School,Madang Avenue Public School,Halinda School,,,,,,,,,,,,,,,,,,,,,
TREGEAR,Tregear Public School,,,,,,,,,,,,,,,,,,,,,,,
LETHBRIDGE PARK,Lethbridge Park Public School,,,,,,,,,,,,,,,,,,,,,,,
WINSTON HILLS,Winston Hills Public School,Winston Heights Public School,St Paul the Apostle Primary School,,,,,,,,,,,,,,,,,,,,,
EMERTON,Emerton Public School,Holy Family Primary School,,,,,,,,,,,,,,,,,,,,,,
MOUNT RIVERVIEW,Mount Riverview Public School,,,,,,,,,,,,,,,,,,,,,,,
WINMALEE,Winmalee Public School,Winmalee High School,,,,,,,,,,,,,,,,,,,,,,
DHARRUK,Dawson Public School,,,,,,,,,,,,,,,,,,,,,,,
HOBARTVILLE,Hobartville Public School,,,,,,,,,,,,,,,,,,,,,,,
BLACKETT,Blackett Public School,Niland School,,,,,,,,,,,,,,,,,,,,,,
WILLMOT,Willmot Public School,,,,,,,,,,,,,,,,,,,,,,,
SHALVEY,Shalvey Public School,Noumea Public School,Chifley College Shalvey Campus,,,,,,,,,,,,,,,,,,,,,
BIDWILL,Bidwill Public School,Chifley College Bidwill Campus,,,,,,,,,,,,,,,,,,,,,,
SOUTH PENRITH,York Public School,Jamisontown Public School,Jamison High School,St Mary MacKillop Primary School,,,,,,,,,,,,,,,,,,,,
GROSE VALE,Grose View Public School,,,,,,,,,,,,,,,,,,,,,,,
ST CLAIR,Clairgate Public School,St Clair Public School,Blackwell Public School,Banks Public School,St Clair High School,Holy Spirit Primary School,,,,,,,,,,,,,,,,,,
KINGS LANGLEY,Kings Langley Public School,,,,,,,,,,,,,,,,,,,,,,,
DEAN PARK,William Dean Public School,,,,,,,,,,,,,,,,,,,,,,,
MINCHINBURY,Minchinbury Public School,,,,,,,,,,,,,,,,,,,,,,,
ERSKINE PARK,James Erskine Public School,Erskine Park High School,Mamre Anglican School,,,,,,,,,,,,,,,,,,,,,
BLIGH PARK,Bligh Park Public School,Chisholm Catholic Primary School,Eagle Arts and Vocational College,,,,,,,,,,,,,,,,,,,,,
GLENMORE PARK,Glenmore Park Public School,Surveyors Creek Public School,Glenmore Park High School,Bethany Catholic Primary School,Caroline Chisholm College,Fernhill School,,,,,,,,,,,,,,,,,,
HASSALL GROVE,Hassall Grove Public School,St Clare's Catholic High School,,,,,,,,,,,,,,,,,,,,,,
GLENDENNING,Glendenning Public School,St Francis of Assisi Primary School,,,,,,,,,,,,,,,,,,,,,,
CLAREMONT MEADOWS,Claremont Meadows Public School,,,,,,,,,,,,,,,,,,,,,,,
BEAUMONT HILLS,Beaumont Hills Public School,Malek Fahd Beaumont Hills,,,,,,,,,,,,,,,,,,,,,,
KELLYVILLE RIDGE,Kellyville Ridge Public School,,,,,,,,,,,,,,,,,,,,,,,
ROPES CROSSING,Ropes Crossing Public School,,,,,,,,,,,,,,,,,,,,,,,
THE PONDS,John Palmer Public School,The Ponds School,Riverbank Public School,The Ponds High School,,,,,,,,,,,,,,,,,,,,
ROSEHILL,Rosehill Public School,,,,,,,,,,,,,,,,,,,,,,,
MCGRATHS HILL,Windsor High School,,,,,,,,,,,,,,,,,,,,,,,
ABERDEEN,Aberdeen Public School,St Joseph's High School Aberdeen,,,,,,,,,,,,,,,,,,,,,,
ADAMSTOWN,Adamstown Public School,Belair Public School,Kotara High School,St Columba's Primary School,St Pius X High School,"St Francis Xavier's College, St Pius X campus",,,,,,,,,,,,,,,,,,
ANNA BAY,Anna Bay Public School,,,,,,,,,,,,,,,,,,,,,,,
AVOCA BEACH,Avoca Beach Public School,,,,,,,,,,,,,,,,,,,,,,,
AWABA,Awaba Public School,,,,,,,,,,,,,,,,,,,,,,,
BARNSLEY,Barnsley Public School,,,,,,,,,,,,,,,,,,,,,,,
BELLBIRD,Bellbird Public School,,,,,,,,,,,,,,,,,,,,,,,
BELLTREES,Belltrees Public School,,,,,,,,,,,,,,,,,,,,,,,
BELMONT,Belmont Public School,Belmont North Public School,Floraville Public School,Belmont High School,St Francis Xavier's Primary School,,,,,,,,,,,,,,,,,,,
BERESFIELD,Beresfield Public School,Francis Greenway High School,,,,,,,,,,,,,,,,,,,,,,
BERKELEY VALE,Berkeley Vale Public School,Tuggerah Lakes Secondary College Berkeley Vale Campus,TLK Alesco School,,,,,,,,,,,,,,,,,,,,,
BLACK HILL,Black Hill Public School,,,,,,,,,,,,,,,,,,,,,,,
BLANDFORD,Blandford Public School,,,,,,,,,,,,,,,,,,,,,,,
BOBS FARM,Bobs Farm Public School,,,,,,,,,,,,,,,,,,,,,,,
BOLWARRA,Bolwarra Public School,,,,,,,,,,,,,,,,,,,,,,,
BOOLAROO,Boolaroo Public School,,,,,,,,,,,,,,,,,,,,,,,
BRANXTON,Branxton Public School,Rosary Park Catholic School,,,,,,,,,,,,,,,,,,,,,,
BROKE,Broke Public School,,,,,,,,,,,,,,,,,,,,,,,
SARATOGA,Brisbania Public School,,,,,,,,,,,,,,,,,,,,,,,
CARDIFF,Cardiff Public School,Cardiff North Public School,Cardiff High School,St Kevin's Primary School,"Aspect Hunter School, Cardiff Satellite",,,,,,,,,,,,,,,,,,,
CARRINGTON,Carrington Public School,,,,,,,,,,,,,,,,,,,,,,,
CASSILIS,Cassilis Public School,,,,,,,,,,,,,,,,,,,,,,,
CESSNOCK,Cessnock Public School,Cessnock East Public School,Cessnock West Public School,Cessnock High School,St Patrick's Primary School,Alesco Senior College - Cessnock Campus,,,,,,,,,,,,,,,,,,
CHARLESTOWN,Charlestown Public School,Charlestown East Public School,Hillsborough Public School,Charlestown South Public School,St Joseph's Primary School,,,,,,,,,,,,,,,,,,,
CLARENCE TOWN,Clarence Town Public School,Glen William Public School,,,,,,,,,,,,,,,,,,,,,,
COORANBONG,Cooranbong Public School,Avondale School,,,,,,,,,,,,,,,,,,,,,,
DENMAN,Denman Public School,St Joseph's Primary School,,,,,,,,,,,,,,,,,,,,,,
DORA CREEK,Dora Creek Public School,,,,,,,,,,,,,,,,,,,,,,,
DUNGOG,Dungog Public School,Dungog High School,St Joseph's Primary School,,,,,,,,,,,,,,,,,,,,,
CONGEWAI,Congewai Public School,,,,,,,,,,,,,,,,,,,,,,,
ELLALONG,Ellalong Public School,,,,,,,,,,,,,,,,,,,,,,,
ELLERSTON,Ellerston Public School,,,,,,,,,,,,,,,,,,,,,,,
EMPIRE BAY,Empire Bay Public School,,,,,,,,,,,,,,,,,,,,,,,
THE ENTRANCE,The Entrance Public School,,,,,,,,,,,,,,,,,,,,,,,
ERINA HEIGHTS,Erina Heights Public School,Central Coast Grammar School,,,,,,,,,,,,,,,,,,,,,,
ERINA,Woodport Public School,Erina High School,Central Coast Adventist School,,,,,,,,,,,,,,,,,,,,,
ETTALONG BEACH,Ettalong Public School,,,,,,,,,,,,,,,,,,,,,,,
FASSIFERN,Fassifern Public School,Charlton Christian College,,,,,,,,,,,,,,,,,,,,,,
SANDY HOLLOW,Sandy Hollow Public School,,,,,,,,,,,,,,,,,,,,,,,
GILLIESTON HEIGHTS,Gillieston Public School,,,,,,,,,,,,,,,,,,,,,,,
WEST GOSFORD,Gosford Public School,,,,,,,,,,,,,,,,,,,,,,,
GRESFORD,Gresford Public School,,,,,,,,,,,,,,,,,,,,,,,
GRETA,Greta Public School,,,,,,,,,,,,,,,,,,,,,,,
HINTON,Hinton Public School,,,,,,,,,,,,,,,,,,,,,,,
HOLGATE,Holgate Public School,,,,,,,,,,,,,,,,,,,,,,,
RATHMINES,Rathmines Public School,,,,,,,,,,,,,,,,,,,,,,,
WOODVILLE,Iona Public School,,,,,,,,,,,,,,,,,,,,,,,
ISLINGTON,Islington Public School,,,,,,,,,,,,,,,,,,,,,,,
JERRYS PLAINS,Jerrys Plains Public School,,,,,,,,,,,,,,,,,,,,,,,
